{
  "missiles": [
    "M01",
    "M02",
    "M03",
    "M04",
    "M05",
    "M06"
  ],
  "targets": [
    "T01",
    "T02",
    "T03",
    "T04"
  ],
  "missile_cost": {
    "M01": 5,
    "M02": 6,
    "M03": 7,
    "M04": 8,
    "M05": 4,
    "M06": 5
  },
  "missile_destructive_payload": {
    "M01": 13,
    "M02": 15,
    "M03": 17,
    "M04": 19,
    "M05": 21,
    "M06": 9
  },
  "target_value": {
    "T01": 25,
    "T02": 30,
    "T03": 35,
    "T04": 40
  },
  "target_health": {
    "T01": 35,
    "T02": 38,
    "T03": 41,
    "T04": 26
  },
  "missile_target_penetration_probability": {
    "M01": {
      "T01": 0.61,
      "T02": 0.64,
      "T03": 0.67,
      "T04": 0.7
    },
    "M02": {
      "T01": 0.67,
      "T02": 0.7,
      "T03": 0.73,
      "T04": 0.76
    },
    "M03": {
      "T01": 0.73,
      "T02": 0.76,
      "T03": 0.79,
      "T04": 0.52
    },
    "M04": {
      "T01": 0.79,
      "T02": 0.52,
      "T03": 0.55,
      "T04": 0.58
    },
    "M05": {
      "T01": 0.55,
      "T02": 0.58,
      "T03": 0.61,
      "T04": 0.64
    },
    "M06": {
      "T01": 0.61,
      "T02": 0.64,
      "T03": 0.67,
      "T04": 0.7
    }
  }
}
